Username,CommentContent,Time,Location
.,可我真的感觉很累，大学忙忙碌碌四年，一无所成，不知道自己何去何从。,9月16日 00:24  ,辽宁
Taylor,小红书过来的,9月16日 00:07  ,河南
cuteiiq,不要迷茫 不要慌张,9月15日 23:48  ,河北
cuteiiq,好温暖,9月15日 23:47  ,河北
星空物語,我来了到了这个年龄  不迷茫都不可能调整好心态明天又是新的开始加油(*´꒳`*)陌生人,9月15日 23:35  ,江苏
👍,1,9月15日 23:26  ,山东
您的昵称已被占用,加油！所有的陌生人，你我皆是黑马！,9月15日 22:33  ,黑龙江
小时候,第一次在某音听，躺床上，不知道为什么，一股子凉气，全身一下子通透了！！,9月15日 22:22  ,安徽
Xiao.,过得去的，过不去的，都会过去,9月15日 22:19  ,江苏
崇尚自由,好感动的曲调和词,9月15日 22:16  ,湖南
沐枫,哇🎊,9月15日 22:14  ,北京
养乐多^ω^,我是不是把这个看的太重了，因为自己的原因没发挥好差两分，失之交臂！感觉缓不过来了！,9月15日 22:01  ,重庆
无法无天的流浪大美人,2024法考必过,9月15日 21:56  ,陕西
小困包Q,考研加油加油啊啊啊！！“每个人花期不同”，虽然看着身边的同学好像从中考，高考到考研，申研都很顺很顺，但是我好像并没有，总是好焦虑，这首歌给我听哭了，希望有一天我也能活出属于自己的精彩吧,9月15日 21:29  ,浙江
李莲花的狐狸精,“不要迷茫 不要慌张 太阳下山 还有月光”00后真的爱惨了这句歌词,9月15日 21:00  ,江苏
.,经管集合了孩子们,9月15日 20:38  ,云南
🌧️☔.,祝她铮铮 祝她昂扬 祝她扎根大地 挺直脊梁,9月15日 20:31  ,广西
我是黑神话天才,云南经济管理学院,9月15日 20:26  ,未知
视觉系,励志正能量,9月15日 20:06  ,江西
蓝精灵,一切都会过去，生活还会继续，加油啊，自己是最棒的,9月15日 19:50  ,山东
Y,你好,9月15日 19:44  ,云南
和光,这首歌的歌词真暖心,9月15日 19:36  ,山西
和光,他强任他强，每个人花期不一样！不要迷茫，不要慌张，太阳下山还有月亮。未来，定会顶峰相见！,9月15日 19:36  ,山西
就是爱音乐,还好有你陪我 我的宝宝有你才是妈妈的幸福啊,9月15日 18:44  ,湖北
Koi,不要迷茫，不要慌张，别想太多，好好生活，太阳下山有月光！,9月15日 17:08  ,广东
肉肉酱,希望你任何时候，都不缺从头再来的勇气。,9月15日 15:32  ,广东
